{
  "schemaVersion": "caatuu-shared-mechanic-capability-catalog-v1",
  "catalogId": "caatuu.shared-mechanic-capabilities",
  "version": "1.0.0",
  "specLocale": "en",
  "authority": "english-authored-shared-contract",
  "capabilityFamilies": [
    {
      "id": "capability-family.contextual-target-realization",
      "revision": 1,
      "definitionEn": "Practice how a target language realizes an English-specified communicative meaning in context without assuming that every language uses the same morphology."
    }
  ],
  "capabilities": [
    {
      "id": "capability.contextual-target-realization.visible-form-choice",
      "revision": 1,
      "familyId": "capability-family.contextual-target-realization",
      "definitionEn": "Choose the context-appropriate target-language form while all candidate target-language forms remain visible.",
      "prerequisiteCapabilityIds": [],
      "contextRequirement": "required",
      "requiredCanonicalContextDimensionIds": [
        "referent-person",
        "time-profile"
      ],
      "mechanicShape": {
        "operation": "discriminate",
        "responseMode": "closed-choice",
        "candidateVisibility": "target-language-options-visible",
        "targetLanguageProduction": false
      },
      "evidenceCeiling": {
        "learningStage": "discriminate",
        "evidenceKind": "comprehension",
        "maximumIndependence": "independent",
        "scoreRequired": true,
        "masteryEligible": false
      }
    }
  ]
}
